{
  "chunk_id": "inheritance-tax-taxable-value",
  "source": {
    "source_kind": "official_regulation_paraphrase",
    "title": "상속세 과세가액 — 추정상속재산·사전증여 가산·채무·장례비 공제",
    "reference": "상속세 및 증여세법 제13조~제15조 / 시행령 제9조"
  },
  "subject": "tax",
  "unit": "inheritance_gift_tax",
  "topic_tags": [
    "inheritance_gift_tax",
    "taxable_value",
    "presumed_inheritance",
    "prior_gift"
  ],
  "applicable_year": 2026,
  "text": "상속세 과세가액 = 총상속재산(비과세 제외) + 추정상속재산 + 가산하는 사전증여재산 − 공과금·채무 − 장례비. ①비과세: 금양임야·묘토 등은 일정 한도 비과세. ②추정상속재산(상증법 제15조): 처분재산·인출금·채무부담액이 상속개시 전 1년 이내 2억원 이상 또는 2년 이내 5억원 이상이고 용도불분명하면 가산. 기준금액 미달이면 0원. ③사전증여재산 가산(제13조): 상속인에게는 상속개시 전 10년 이내, 상속인 외의 자에게는 5년 이내 증여재산을 '증여 당시 시가'로 가산. ④장례비(시행령 제9조): 일반장례비 실제지출액(증빙) 한도 1,000만원(증빙 없어도 최소 500만원 인정), 봉안·자연장지 비용 별도 한도 500만원. 따라서 장례비 최대 공제 1,500만원. 예: 총상속 29억 − 채무 2억 − 장례비 1,500만 + 사전증여 5억 = 31억 8,500만원.",
  "keywords": [
    "상속세 과세가액",
    "추정상속재산 1년 2억 2년 5억",
    "사전증여 10년 가산",
    "증여당시 시가",
    "채무 공제",
    "장례비 1000만원 봉안 500만원",
    "비과세 금양임야"
  ],
  "rights_status": "official_paraphrase",
  "review_status": "ai_draft"
}
