{
  "chunk_id": "cvp-margin-of-safety",
  "source": {
    "source_kind": "internal_summary",
    "title": "CVP 분석 — BEP, 안전한계율, 영업레버리지",
    "reference": null
  },
  "subject": "accounting",
  "unit": "cost_management",
  "topic_tags": [
    "cvp_analysis",
    "break_even_point",
    "margin_of_safety",
    "operating_leverage"
  ],
  "applicable_year": null,
  "text": "단위당 공헌이익 = 단위당 판매가격 - 단위당 변동비. 공헌이익률 = 단위당 공헌이익 / 단위당 판매가격. 손익분기점(BEP) 판매량 = 고정비 / 단위당 공헌이익. BEP 매출액 = 고정비 / 공헌이익률. 안전한계율 = (현재 매출 - BEP 매출) / 현재 매출. 따라서 안전한계율이 r 일 때 현재 매출 = BEP 매출 / (1 - r). 영업레버리지도 = 공헌이익 / 영업이익 = 매출 변화율에 대한 이익 변화 배수. 복수 제품은 매출배합 가중평균 공헌이익률을 사용한다.",
  "keywords": [
    "BEP",
    "공헌이익",
    "공헌이익률",
    "안전한계율",
    "영업레버리지",
    "매출배합"
  ],
  "rights_status": "self_generated",
  "review_status": "expert_reviewed"
}
